{
  "$schema": "http://json-schema.org/draft-07/schema#",
  "title": "CandidateResumeSchema",
  "description": "User-provided resume facts shared by Draft, Master and Variant; omissions and null never imply candidate facts.",
  "type": "object",
  "properties": {
    "basics": {
      "type": [
        "object",
        "null"
      ],
      "properties": {
        "name": {
          "type": [
            "string",
            "null"
          ],
          "description": "Candidate's full name"
        },
        "title": {
          "type": [
            "string",
            "null"
          ],
          "description": "Professional job title or target role"
        },
        "email": {
          "type": [
            "string",
            "null"
          ],
          "format": "email"
        },
        "phone": {
          "type": [
            "string",
            "null"
          ]
        },
        "location": {
          "type": [
            "string",
            "null"
          ]
        },
        "website": {
          "type": [
            "string",
            "null"
          ]
        },
        "github": {
          "type": [
            "string",
            "null"
          ]
        },
        "summary": {
          "type": [
            "string",
            "null"
          ],
          "description": "Optional concise synthesis of supported experience; length follows the language and content, not a fixed word count"
        }
      },
      "additionalProperties": false
    },
    "skills": {
      "type": [
        "array",
        "null"
      ],
      "items": {
        "type": [
          "object",
          "null"
        ],
        "properties": {
          "category": {
            "type": [
              "string",
              "null"
            ]
          },
          "items": {
            "type": [
              "array",
              "null"
            ],
            "items": {
              "type": [
                "string",
                "null"
              ]
            }
          },
          "highlighted": {
            "type": [
              "array",
              "null"
            ],
            "items": {
              "type": [
                "string",
                "null"
              ]
            }
          }
        },
        "additionalProperties": false
      }
    },
    "experience": {
      "type": [
        "array",
        "null"
      ],
      "items": {
        "type": [
          "object",
          "null"
        ],
        "properties": {
          "company": {
            "type": [
              "string",
              "null"
            ]
          },
          "role": {
            "type": [
              "string",
              "null"
            ]
          },
          "startDate": {
            "type": [
              "string",
              "null"
            ]
          },
          "endDate": {
            "type": [
              "string",
              "null"
            ]
          },
          "location": {
            "type": [
              "string",
              "null"
            ]
          },
          "summary": {
            "type": [
              "string",
              "null"
            ]
          },
          "bullets": {
            "type": [
              "array",
              "null"
            ],
            "items": {
              "type": [
                "object",
                "null"
              ],
              "properties": {
                "text": {
                  "type": [
                    "string",
                    "null"
                  ]
                },
                "evidenceLevel": {
                  "type": [
                    "string",
                    "null"
                  ],
                  "enum": [
                    "L1",
                    "L2",
                    "L3",
                    null
                  ]
                },
                "evidenceSource": {
                  "type": [
                    "string",
                    "null"
                  ]
                },
                "keywords": {
                  "type": [
                    "array",
                    "null"
                  ],
                  "items": {
                    "type": [
                      "string",
                      "null"
                    ]
                  }
                }
              },
              "additionalProperties": false
            }
          }
        },
        "additionalProperties": false
      }
    },
    "projects": {
      "type": [
        "array",
        "null"
      ],
      "items": {
        "type": [
          "object",
          "null"
        ],
        "properties": {
          "name": {
            "type": [
              "string",
              "null"
            ]
          },
          "role": {
            "type": [
              "string",
              "null"
            ]
          },
          "techStack": {
            "type": [
              "array",
              "null"
            ],
            "items": {
              "type": [
                "string",
                "null"
              ]
            }
          },
          "repoUrl": {
            "type": [
              "string",
              "null"
            ]
          },
          "demoUrl": {
            "type": [
              "string",
              "null"
            ]
          },
          "startDate": {
            "type": [
              "string",
              "null"
            ]
          },
          "endDate": {
            "type": [
              "string",
              "null"
            ]
          },
          "bullets": {
            "type": [
              "array",
              "null"
            ],
            "items": {
              "type": [
                "object",
                "null"
              ],
              "properties": {
                "text": {
                  "type": [
                    "string",
                    "null"
                  ]
                },
                "evidenceLevel": {
                  "type": [
                    "string",
                    "null"
                  ],
                  "enum": [
                    "L1",
                    "L2",
                    "L3",
                    null
                  ]
                },
                "evidenceSource": {
                  "type": [
                    "string",
                    "null"
                  ]
                },
                "keywords": {
                  "type": [
                    "array",
                    "null"
                  ],
                  "items": {
                    "type": [
                      "string",
                      "null"
                    ]
                  }
                }
              },
              "additionalProperties": false
            }
          }
        },
        "additionalProperties": false
      }
    },
    "education": {
      "type": [
        "array",
        "null"
      ],
      "items": {
        "type": [
          "object",
          "null"
        ],
        "properties": {
          "institution": {
            "type": [
              "string",
              "null"
            ]
          },
          "degree": {
            "type": [
              "string",
              "null"
            ]
          },
          "field": {
            "type": [
              "string",
              "null"
            ]
          },
          "startDate": {
            "type": [
              "string",
              "null"
            ]
          },
          "endDate": {
            "type": [
              "string",
              "null"
            ]
          },
          "gpa": {
            "type": [
              "string",
              "null"
            ]
          },
          "honors": {
            "type": [
              "array",
              "null"
            ],
            "items": {
              "type": [
                "string",
                "null"
              ]
            }
          },
          "summary": {
            "type": [
              "string",
              "null"
            ]
          }
        },
        "additionalProperties": false
      }
    },
    "certifications": {
      "type": [
        "array",
        "null"
      ],
      "items": {
        "type": [
          "string",
          "null"
        ]
      }
    },
    "language": {
      "type": [
        "string",
        "null"
      ]
    }
  },
  "additionalProperties": false
}
