{
  "basics": {
    "name": "张集成",
    "title": "全栈工程师",
    "email": "364475182@qq.com",
    "github": "https://github.com/Max-Samson/knowme-careerforge-skill.git",
    "summary": "拥有坚实的技术研发与工程化落地实战经验，主导过多个基于 Playwright, TypeScript, JavaScript 的核心系统设计与交付。"
  },
  "skills": [
    {
      "category": "核心技术栈",
      "items": [
        "Playwright",
        "TypeScript",
        "JavaScript",
        "HTML",
        "Python",
        "CSS"
      ],
      "highlighted": [
        "Playwright",
        "TypeScript",
        "JavaScript",
        "HTML"
      ]
    },
    {
      "category": "工程化与架构",
      "items": [
        "自动化单元/集成测试"
      ],
      "highlighted": [
        "自动化单元/集成测试"
      ]
    }
  ],
  "experience": [
    {
      "company": "[请填写：公司名称]",
      "role": "全栈工程师",
      "startDate": "[请填写：开始时间]",
      "endDate": "至今",
      "location": "[请填写：工作地点]",
      "summary": "负责核心产品研发与关键架构攻坚",
      "bullets": [
        {
          "text": "基于 Playwright, TypeScript 构建核心工程架构，实现高可靠端到端业务流",
          "evidenceLevel": "L1",
          "evidenceSource": "代码库依赖配置文件 (package.json)",
          "keywords": [
            "Playwright",
            "TypeScript"
          ]
        },
        {
          "text": "主导设计工程架构体系，落地 自动化单元/集成测试，保障交付效率与质量",
          "evidenceLevel": "L1",
          "evidenceSource": "工程根目录架构配置文件与流水线定义",
          "keywords": [
            "Architecture",
            "CI/CD",
            "Testing",
            "DevOps"
          ]
        },
        {
          "text": "持续推进工程重构与版本迭代，累计提交 13 次代码并完成多版本发布",
          "evidenceLevel": "L2",
          "evidenceSource": "Git 提交历史与版本变更记录",
          "keywords": [
            "Refactoring",
            "Git",
            "Release Engineering"
          ]
        }
      ]
    }
  ],
  "projects": [
    {
      "name": "knowme-careerforge-skill",
      "role": "核心负责人 / 主力开发者",
      "techStack": [
        "Playwright",
        "TypeScript"
      ],
      "repoUrl": "https://github.com/Max-Samson/knowme-careerforge-skill.git",
      "startDate": "[请填写：开始时间]",
      "endDate": "至今",
      "bullets": [
        {
          "text": "基于 Playwright, TypeScript 构建核心工程架构，实现高可靠端到端业务流",
          "evidenceLevel": "L1",
          "evidenceSource": "代码库依赖配置文件 (package.json)"
        },
        {
          "text": "主导设计工程架构体系，落地 自动化单元/集成测试，保障交付效率与质量",
          "evidenceLevel": "L1",
          "evidenceSource": "工程根目录架构配置文件与流水线定义"
        },
        {
          "text": "持续推进工程重构与版本迭代，累计提交 13 次代码并完成多版本发布",
          "evidenceLevel": "L2",
          "evidenceSource": "Git 提交历史与版本变更记录"
        }
      ]
    }
  ],
  "education": [
    {
      "institution": "[请填写：学校名称]",
      "degree": "[请填写：学历与专业]",
      "startDate": "[请填写：入学时间]",
      "endDate": "[请填写：毕业时间]"
    }
  ]
}